{
  "$schema": "schema.json",
  "schema_version": 1,
  "id": "single-wuxga",
  "description": "Baseline 1920x1200 WUXGA desktop.",
  "profile": "xfce-inspired",
  "theme": "qinda-light",
  "outputs": [
    {
      "name": "Virtual-1",
      "enabled": true,
      "primary": true,
      "position": { "x": 0, "y": 0 },
      "mode": { "width": 1920, "height": 1200, "refresh_hz": 60 },
      "scale": 1.0,
      "transform": "normal"
    }
  ],
  "events": []
}
