{
  "$schema": "schema.json",
  "schema_version": 1,
  "id": "gathered-640x480",
  "description": "640x480 nested output with a committed top-panel reservation for gathered paging.",
  "profile": "qindaqt",
  "theme": "qinda-dusk",
  "outputs": [
    {
      "name": "Virtual-1",
      "enabled": true,
      "primary": true,
      "position": { "x": 0, "y": 0 },
      "mode": { "width": 640, "height": 480, "refresh_hz": 60 },
      "scale": 1.0,
      "transform": "normal"
    }
  ],
  "events": []
}
